{
  "format": "tabspack",
  "schemaVersion": 1,
  "exportedAt": "2026-09-24T09:00:00+05:30",
  "name": "Reading list",
  "tags": ["weekend"],
  "windows": [
    {
      "name": "To read",
      "tabs": [
        { "url": "https://example.com/one", "title": "One" },
        { "url": "https://example.com/two", "title": "Two", "group": "Later" },
        { "url": "https://example.com/three", "group": "Later" }
      ]
    }
  ]
}
